{
  "$schema": "http://json-schema.org/draft-07/schema#",
  "title": "APIGatewayCustomAuthorizerEvent",
  "type": "object",
  "properties": {
    "version": {
      "type": "string"
    },
    "type": {
      "type": "string"
    },
    "methodArn": {
      "type": "string"
    },
    "identitySource": {
      "type": "string"
    },
    "authorizationToken": {
      "type": "string"
    },
    "resource": {
      "type": "string"
    },
    "path": {
      "type": "string"
    },
    "httpMethod": {
      "type": "string"
    },
    "headers": {
      "type": "object",
      "additionalProperties": {
        "type": "string"
      }
    },
    "queryStringParameters": {
      "type": "object",
      "additionalProperties": {
        "type": "string"
      }
    },
    "pathParameters": {
      "type": "object",
      "additionalProperties": true
    },
    "stageVariables": {
      "type": "object",
      "additionalProperties": {
        "type": "string"
      }
    },
    "requestContext": {
      "type": "object",
      "additionalProperties": true
    }
  },
  "additionalProperties": false
}